commit	interp_score	sparsity	mono	ortho	locality	status	description
56f7a0f	1.000000	1.000000	1.000000	1.000000	1.000000	keep	add phases 1701-1710: energy dist, mean shift, cosine hist, conditional entropy, rank order, norm vs acc, profile similarity, consistency, subspace angle
7de3d2b	1.000000	1.000000	1.000000	1.000000	1.000000	keep	add phases 1711-1720: bimodality, mutual pred, zero-crossing, layer alignment, encoding sparsity, relative proj, explained var, random subspace, spread
6601a4e	1.000000	1.000000	1.000000	1.000000	1.000000	keep	add phases 1721-1730: weighted layer, contribution entropy, L2 dist, proj corr, curvature, between/within, inner product, response scaling, subspace dim
0590207	1.000000	1.000000	1.000000	1.000000	1.000000	keep	add phases 1731-1740: cross-layer transfer, moment profile, class imbalance, max discrimination, eigenvalue ratios, PCA alignment, cluster quality, bootstrap, variance decomp
eab5063	1.000000	1.000000	1.000000	1.000000	1.000000	keep	add phases 1741-1750: path length, outlier count, cross-concept var, proj MI, single-neuron, norm CV, mean vs median, Mahal, identity angle, 1750 milestone
90bb36c	1.000000	1.000000	1.000000	1.000000	1.000000	keep	add phases 1751-1760: norm entropy, sample efficiency, transition types, activation range, residual signal, threshold, signal/noise, point-biserial, centroid angle
b7ef5ad	1.000000	1.000000	1.000000	1.000000	1.000000	keep	add phases 1761-1770: cumulative variance, dynamic range, layerwise cosine, direction removal, normalized dist, Gram spectrum, Bhattacharyya, selectivity, separation
8cdc9cc	1.000000	1.000000	1.000000	1.000000	1.000000	keep	add phases 1771-1780: layer mean cosine, L1/L2, best ortho layer, weighted estimation, overlap area, centroid norm, cross spread, neuron overlap, discriminability
2bbd02a	1.000000	1.000000	1.000000	1.000000	1.000000	keep	add phases 1781-1790: projection skewness, inter-layer corr, mean abs diff, layer window, sign flips, tail ratio, layer dep, explained ratio, normality
feddc34	1.000000	1.000000	1.000000	1.000000	1.000000	keep	phases 1791-1800: pair angle, smoothed accuracy, cosine stability, aggregate metrics, percentile threshold, signal energy, comprehensive stats, interaction matrix, quality assessment, milestone
aeb5dd7	1.000000	1.000000	1.000000	1.000000	1.000000	keep	phases 1801-1810: firing rate distribution, layer gradient, pair MI, selectivity entropy, direction rank, norm stats, cos vs eucl, kurtosis, subspace overlap, contribution asymmetry
048f6b1	1.000000	1.000000	1.000000	1.000000	1.000000	keep	phases 1811-1820: cross-layer correlation, variance ratio, bootstrap stability, projection distribution, dead/alive, L1/L2 norm, classification margin, PCA variance, max neuron, checkpoint
fbca3cc	1.000000	1.000000	1.000000	1.000000	1.000000	keep	phases 1821-1830: neuron correlation network, whitened angles, bimodality, centroid distances, transition smoothness, effective dim, SVM margin, Gini, temporal evolution, checkpoint
df31d7a	1.000000	1.000000	1.000000	1.000000	1.000000	keep	phases 1831-1840: mutual exclusivity, outlier robustness, info content, SNR, Gram det, skewness, pair interference, activation range, encoding redundancy, checkpoint
c90a0cb	1.000000	1.000000	1.000000	1.000000	1.000000	keep	phases 1841-1850: co-activation, angular velocity, response profile, emergence gradient, complement energy, activation entropy, eigenspectrum, discrimination power, shared variance, milestone
961eae5	1.000000	1.000000	1.000000	1.000000	1.000000	keep	phases 1851-1860: quantile analysis, decorrelation, d-prime, split stability, population sparsity, cross-layer alignment, functional grouping, signal persistence, pair angle evolution, checkpoint
660d0db	1.000000	1.000000	1.000000	1.000000	1.000000	keep	phases 1861-1870: dynamic range, Fisher separability, response consistency, subspace dim, mean-field, layer specialization, compressibility, norm growth, encoding capacity, checkpoint
249b041	1.000000	1.000000	1.000000	1.000000	1.000000	keep	phases 1871-1880: response symmetry, spectral gap, mode analysis, projection overlap, importance stability, reconstruction error, biserial corr, curvature, info geometry, checkpoint
171e8a7	1.000000	1.000000	1.000000	1.000000	1.000000	keep	phases 1881-1890: top-K overlap, norm profile, response heterogeneity, nullspace dim, percentile sep, mutual coherence, classification contrib, angle distribution, tail analysis, checkpoint
b29cbf1	1.000000	1.000000	1.000000	1.000000	1.000000	keep	phases 1891-1900: LOO stability, specificity ratio, random baseline, sparsity patterns, Gram structure, temporal consistency, variance decomposition, max sep layer, summary stats, 1900 MILESTONE
adc580a	1.000000	1.000000	1.000000	1.000000	1.000000	keep	phases 1901-1910: HHI, CV accuracy, magnitude ordering, cosine stability, distributional shift, effective rank evolution, encoding efficiency, layer consensus, joint stats, checkpoint
2dfb621	1.000000	1.000000	1.000000	1.000000	1.000000	keep	phases 1911-1920: pairwise interaction, KL divergence, covariance, PCA alignment, response profile, orthogonality after projection, cluster analysis, CI, contribution decomposition, checkpoint
2f17a65	1.000000	1.000000	1.000000	1.000000	1.000000	keep	phases 1921-1930: linearity check, subspace angle, per-neuron SNR, optimal layer, rank corr, least squares, info bottleneck, sample sensitivity, encoding diversity, checkpoint
e501a41	1.000000	1.000000	1.000000	1.000000	1.000000	keep	phases 1931-1940: relative importance, weighted avg layer, exclusive activation, Mahalanobis, activation regime, Cohen's d, magnitude profile, normalization invariance, layer entropy, checkpoint
f5fe4c4	1.000000	1.000000	1.000000	1.000000	1.000000	keep	phases 1941-1950: discrimination efficiency, angle to final, corr rank, noise robustness, discriminative corr, best-worst gap, permutation imp, geometric median, uniformity, 1950 milestone
248ea74	1.000000	1.000000	1.000000	1.000000	1.000000	keep	phases 1951-1960: signal fraction, mean abs cosine, variance partition, cross-concept generalization, pos/neg ratio, half-space margin, layer corr, projection skewness, range ratio, checkpoint
de1deac	1.000000	1.000000	1.000000	1.000000	1.000000	keep	phases 1961-1970: dispersion, pairwise independence, energy distribution, convergence rate, peak width, info density, centroid shift, explained var, pos/neg overlap, checkpoint
74d258a	1.000000	1.000000	1.000000	1.000000	1.000000	keep	phases 1971-1980: stability vs magnitude, condition number, global stats, geometric props, MI profile, normality test, layer profile, orthogonality check, neuron stats, checkpoint
f9f63a9	1.000000	1.000000	1.000000	1.000000	1.000000	keep	phases 1981-1990: direction consistency, signal power, class separation, all-layer summary, final sparsity/independence/monosemanticity/locality, pre-2000 summary, countdown
9f8e4bf	1.000000	1.000000	1.000000	1.000000	1.000000	keep	phases 1991-2000: final norms, top neurons, pairwise angles, accuracy, Gram matrix, emergence layers, cross-concept overlap, interpretability report, 2000 MEGA MILESTONE
46471ba	1.000000	1.000000	1.000000	1.000000	1.000000	keep	phases 2001-2010: manifold dim, robustness summary, global importance, inter-layer agreement, higher moments, info geometry, dependency graph, quality score, research status, post-2000 checkpoint
827f248	1.000000	1.000000	1.000000	1.000000	1.000000	keep	phases 2011-2020: gradient flow, firing asymmetry, cross-layer correlation, selectivity entropy, pairwise interference, variance decomposition, kurtosis, subsample stability, magnitude profile
3fb7257	1.000000	1.000000	1.000000	1.000000	1.000000	keep	phases 2021-2030: shared neuron importance, direction norm evolution, within-class spread, transition sharpness, residual correlation, dimensionality, MI, Gini, PCA
b7fc3e5	1.000000	1.000000	1.000000	1.000000	1.000000	keep	phases 2031-2040: dynamic range, direction vs PCs, SNR profile, skewness, pairwise angles, dead neurons, locality index, Jaccard overlap, covariance spectrum
a77312d	1.000000	1.000000	1.000000	1.000000	1.000000	keep	phases 2041-2050: centroid distance ratio, importance stability, projection distribution, neuron exclusivity, peak alignment, activation shift, Gram condition, adjacent layer corr, angle to mean
7cd3e46	1.000000	1.000000	1.000000	1.000000	1.000000	keep	phases 2051-2060: firing rate consistency, subspace volume, IQR spread, DoM vs LDA, info gain, bimodality, per-sample separation, weighted layer, neuron-concept corr
480b640	1.000000	1.000000	1.000000	1.000000	1.000000	keep	phases 2061-2070: dropout robustness, effective rank, mode count, persistence length, separability margin, neuron redundancy, subspace overlap, norm ratio, direction curvature
6a33193	1.000000	1.000000	1.000000	1.000000	1.000000	keep	phases 2071-2080: tail heaviness, inner product spectrum, repr entropy, cluster quality, L1/L2 sparsity, direction reproducibility, signal/noise, response monotonicity, centroid trajectory
a746067	1.000000	1.000000	1.000000	1.000000	1.000000	keep	phases 2081-2090: power law fit, projection gap, layer contribution, concept-specific neuron count, angular dispersion, correlation network, dimensionality gap, orthogonal residual, pair MI
854f38b	1.000000	1.000000	1.000000	1.000000	1.000000	keep	phases 2091-2100: specificity index, angle matrix, discriminability curve, whitening effect, variance ratio, compressibility, direction stability, mutual separability, response clustering — 2100 MILESTONE
ef7010c	1.000000	1.000000	1.000000	1.000000	1.000000	keep	phases 2111-2120: response symmetry, mutual angle stability, Fisher ratio, coherence length, norm distribution, rank correlation, isotropy, projection confidence, spanning set
7e0b087	1.000000	1.000000	1.000000	1.000000	1.000000	keep	phases 2121-2130: pairwise synergy, variance explained, info flow, histogram entropy, perturbation robustness, best layer alignment, autocorrelation, norm concentration, disentanglement
5081619	1.000000	1.000000	1.000000	1.000000	1.000000	keep	phases 2131-2140: quantile analysis, LOO stability, gradient magnitude, effect size distribution, direction product, signal decay, max-min gap, depth profile, angular velocity
7643f23	1.000000	1.000000	1.000000	1.000000	1.000000	keep	phases 2141-2150: correlation spectrum, projection skewness, top neuron shift, info rate, orthogonal complement, subspace angle, bimodality test, cosine decay, cross-concept prediction
7b34498	1.000000	1.000000	1.000000	1.000000	1.000000	keep	phases 2151-2160: heteroscedasticity, curvature integral, Fisher separability, range utilization, mean field alignment, Jacobian estimate, layer entropy, MAD, null space dim
2e878f4	1.000000	1.000000	1.000000	1.000000	1.000000	keep	phases 2161-2170: inner product evolution, normality test, robustness score, co-activation pairs, projection kurtosis, decodability profile, R², stability window, cross-class asymmetry
a857cfa	1.000000	1.000000	1.000000	1.000000	1.000000	keep	phases 2171-2180: GS residuals, percentile gap, spectral gap, mutual exclusivity, shared variance, magnitude growth, sign consistency, concentration ratio, cross-layer projection
97a8f0d	1.000000	1.000000	1.000000	1.000000	1.000000	keep	phases 2181-2190: energy spectrum, response reliability, effective sparsity, angles at depths, dynamic range, parsimony, energy per layer, rank stability, total variation
25739d6	1.000000	1.000000	1.000000	1.000000	1.000000	keep	phases 2191-2200: cluster distance ratio, projection range, quick MI, normalized distance, layer selectivity, activation entropy, dimension consensus, separability index, concept hierarchy — 2200 MILESTONE
2f0d640	1.000000	1.000000	1.000000	1.000000	1.000000	keep	phases 2201-2210: median-split, mutual coherence, spread ratio, cosine histogram, reconstruction error, d-prime, angular momentum, overlap coefficient, signal monotonicity
55cddc2	1.000000	1.000000	1.000000	1.000000	1.000000	keep	phases 2211-2220: positive fraction, projection bimodality, composite stability, selectivity depth, direction distance, CV, polarity consistency, compactness, angle trend
d71615a	1.000000	1.000000	1.000000	1.000000	1.000000	keep	phases 2221-2230: weighted importance, AUC, dispersion, distinguishability, direction half-life, peak width FWHM, max neuron contribution, geodesic distance, layer diversity
7684293	1.000000	1.000000	1.000000	1.000000	1.000000	keep	phases 2231-2240: layer ensemble, IQM, projection uniformity, cosine at best layers, peak-to-mean, tangent angle, signal bandwidth, point-biserial, projection entropy
93ae23d	1.000000	1.000000	1.000000	1.000000	1.000000	keep	phases 2241-2250: Mahalanobis, zero-crossing, noise stability, redundancy, overlap index, concentration, PCA alignment, persistence, top-K stability — 2250 checkpoint
cba8ec8	1.000000	1.000000	1.000000	1.000000	1.000000	keep	phases 2251-2270: firing asymmetry, layer gradient, kurtosis, selectivity entropy, direction drift, effective dim, response linearity, MI, norm dist, SNR, co-activation, variance explained, sparsity ratio, bootstrap, transition sharpness, Gini, angle matrix, residual
12cdafa	1.000000	1.000000	1.000000	1.000000	1.000000	keep	phases 2271-2280: mean activation shift, polarity consistency, PCA loading, within-class spread, rank correlation, separability, correlation matrix, layer-wise rank, discrimination power
238104c	1.000000	1.000000	1.000000	1.000000	1.000000	keep	phases 2281-2290: layer specificity, concept interference, activation range, subspace overlap, projection variance, contribution skewness, multi-layer coherence, magnitude profile, direction norm profile
014d84b	1.000000	1.000000	1.000000	1.000000	1.000000	keep	phases 2291-2300: specialization ratio, layer pair correlation, exclusivity index, distribution modality, encoding efficiency, ensemble agreement, importance stability, direction robustness, energy distribution — MILESTONE 2300
752b13a	1.000000	1.000000	1.000000	1.000000	1.000000	keep	phases 2301-2310: cross-concept transfer, histogram stats, direction temperature, layer-wise variance ratio, response percentiles, independence test, layer contribution, firing rate, signal decay
23752e0	1.000000	1.000000	1.000000	1.000000	1.000000	keep	phases 2311-2320: covariance structure, SVD alignment, multi-concept contribution, representation similarity, angle consistency, peak layer distribution, concentration index, decodability margin, subspace dimensionality
831c2e2	1.000000	1.000000	1.000000	1.000000	1.000000	keep	phases 2321-2330: tail weight, projection gap, importance correlation, centroid distance, sparsity thresholds, concept emergence, consistency score, orthogonality score, signed contribution
357876b	1.000000	1.000000	1.000000	1.000000	1.000000	keep	phases 2331-2340: response symmetry, noise robustness, neuron utilization, angle variance, outlier analysis, Gram-Schmidt residual, range stability, separability per layer, power law fit
c286c8b	1.000000	1.000000	1.000000	1.000000	1.000000	keep	phases 2341-2350: point-biserial correlation, whitened angles, mode count, norm growth, importance entropy, discrimination difficulty, quantile spread, split-half stability, top/bottom ratio
a407e11	1.000000	1.000000	1.000000	1.000000	1.000000	keep	phases 2351-2360: max/min layer, cross-validation, profile similarity, coherence all, variance explained, normality test, cumulative share, angle with mean, coefficient of variation
b1c873d	1.000000	1.000000	1.000000	1.000000	1.000000	keep	phases 2361-2370: sparse coding quality, mean absolute projection, spectral gap, effective rank, pairwise distance, MI with label, decorrelation score, Cohen's d, layer correlation
ff5ec7f	1.000000	1.000000	1.000000	1.000000	1.000000	keep	phases 2371-2380: cluster purity, cosine distribution, concept specificity per layer, projection overlap, absolute mean profile, subsampling stability, max activation, angular deviation, positive fraction
9561c11	1.000000	1.000000	1.000000	1.000000	1.000000	keep	phases 2381-2390: rank stability, separation ratio, activation balance, angular separation, mean-centering, projection SNR, layer difference norm, Gram eigenvalues, AUC
257ff92	1.000000	1.000000	1.000000	1.000000	1.000000	keep	phases 2391-2400: relative importance, projection skewness, information content, mutual coherence, transition smoothness, projection kurtosis, global mean subtraction, total variance, dynamic range — MILESTONE 2400
abeca91	1.000000	1.000000	1.000000	1.000000	1.000000	keep	phases 2401-2410: global importance rank, null space dim, layer-specific neurons, condition number per layer, signed balance, random direction comparison, variance ratio, reconstruction error, layer similarity chain
2bb1df4	1.000000	1.000000	1.000000	1.000000	1.000000	keep	phases 2411-2420: median importance, pairwise inner products, importance percentiles, projection min/max, top neuron consistency, norm ratio, weighted mean layer, stability summary, single-neuron accuracy
d8518f4	1.000000	1.000000	1.000000	1.000000	1.000000	keep	phases 2421-2430: dot product distribution, cross-layer angle matrix, direction component analysis, projection accuracy per layer, high-importance overlap, adjacent layer cosine, mean abs component, best layer per concept, summary stats
5027879	1.000000	1.000000	1.000000	1.000000	1.000000	keep	phases 2431-2440: firing rate asymmetry, projection bimodality, correlation network, layer gradient magnitude, shared neuron importance, projection range, entropy per layer, PCA explained variance, direction stability
2ef97d2	1.000000	1.000000	1.000000	1.000000	1.000000	keep	phases 2441-2450: neuron response linearity, cross-concept transfer, activation magnitude ratio, direction component sparsity, classification margin, activation skewness, concept pair angle, effective dimensionality, neuron-concept MI
1239d49	1.000000	1.000000	1.000000	1.000000	1.000000	keep	phases 2451-2460: SNR profile, dead neuron fraction, direction cosine with mean, neuron consistency, projection overlap, activation norm profile, centroid distance, within-class compactness, random projection baseline
9e08227	1.000000	1.000000	1.000000	1.000000	1.000000	keep	phases 2461-2470: subspace overlap SVD, residual after projection, top neuron distribution, layer-specific direction quality, direction robustness, neuron activation range, separability index, multi-layer consistency, outlier detection
